{
  "$schema": "https://json-schema.org/draft/2020-12/schema",
  "title": "Programmable Launch CLI 4.1.4 client source binding",
  "description": "Source metadata for CLI 4.1.4, capability-selected Ethereum fresh packs and explicit 3.5/3.6 support. Full release readiness requires the unchanged API 4.1.0 release gates.",
  "type": "object",
  "additionalProperties": false,
  "required": [
    "$schema",
    "schemaVersion",
    "package",
    "apiProfile",
    "ethereumClient",
    "existingApiReleaseBinding",
    "coverage",
    "clientFiles",
    "machineContracts"
  ],
  "properties": {
    "$schema": {
      "const": "./cli-release-binding.schema.json"
    },
    "schemaVersion": {
      "const": "programmable.launch-cli-v4-client-release-binding.v1"
    },
    "package": {
      "type": "object",
      "additionalProperties": false,
      "required": [
        "name",
        "version",
        "tag",
        "repository"
      ],
      "properties": {
        "name": {
          "const": "@programmable/launch"
        },
        "version": {
          "const": "4.1.4"
        },
        "tag": {
          "const": "programmable-launch-v4.1.4"
        },
        "repository": {
          "const": "programmablehq/PROGRAMMABLE"
        }
      }
    },
    "apiProfile": {
      "type": "object",
      "additionalProperties": false,
      "required": [
        "schemaVersion",
        "structuralProfileId",
        "businessProfileId",
        "admissionDescriptorDigest",
        "admissionPolicyDigest",
        "admissionBindingDigest",
        "admissionSchemaDigest",
        "profileRevision",
        "profileVersion",
        "profileDigest"
      ],
      "properties": {
        "schemaVersion": {
          "const": "programmable.custom-launch-profile-ref.v4"
        },
        "structuralProfileId": {
          "const": "programmable.custom-launch.robinhood-mainnet.v1"
        },
        "businessProfileId": {
          "const": "robinhood-production-launch"
        },
        "admissionDescriptorDigest": {
          "const": "sha256:b09611360e284641873fdb2914b4282e0545e32ea587b278fcd11f4db9a4e7f5"
        },
        "admissionPolicyDigest": {
          "const": "sha256:47801f57e2365f89eb7397a2df10d697bd1f756ec01536b9b34755e89809da04"
        },
        "admissionBindingDigest": {
          "const": "sha256:5b2486f35fcd44bd476cafd5bfb5a12decf05a756ba237ca191928f5414c721e"
        },
        "admissionSchemaDigest": {
          "const": "sha256:6a8194a3b5d8b6432a95ec04da3cd86091ad64c93c0531125caf00ecb919c8cf"
        },
        "profileRevision": {
          "const": 2
        },
        "profileVersion": {
          "const": "4.1.0"
        },
        "profileDigest": {
          "const": "sha256:b0fca91264a49d358ed1a9eec2a679b59a48d716b71475bef583c2545e1ee502"
        }
      }
    },
    "existingApiReleaseBinding": {
      "type": "object",
      "additionalProperties": false,
      "required": [
        "schemaVersion",
        "path",
        "sha256"
      ],
      "properties": {
        "schemaVersion": {
          "const": "programmable.launch-cli-v4-release-binding.v2"
        },
        "path": {
          "const": "docs/operations/releases/custom-launch-v4.1/cli-release-binding.json"
        },
        "sha256": {
          "type": "string",
          "pattern": "^sha256:[0-9a-f]{64}$"
        }
      }
    },
    "coverage": {
      "type": "object",
      "additionalProperties": false,
      "required": [
        "path",
        "schemaVersion",
        "authentication",
        "requestAuthorization",
        "activatesWriteProfile"
      ],
      "properties": {
        "path": {
          "const": "/v4/chains/4663/launch-coverage"
        },
        "schemaVersion": {
          "const": "programmable.robinhood-launch-coverage.v1"
        },
        "authentication": {
          "const": "none"
        },
        "requestAuthorization": {
          "const": false
        },
        "activatesWriteProfile": {
          "const": false
        }
      }
    },
    "clientFiles": {
      "type": "array",
      "minItems": 27,
      "maxItems": 27,
      "prefixItems": [
        {
          "type": "object",
          "additionalProperties": false,
          "required": [
            "path",
            "sha256"
          ],
          "properties": {
            "path": {
              "const": "packages/launch/package.json"
            },
            "sha256": {
              "type": "string",
              "pattern": "^sha256:[0-9a-f]{64}$"
            }
          }
        },
        {
          "type": "object",
          "additionalProperties": false,
          "required": [
            "path",
            "sha256"
          ],
          "properties": {
            "path": {
              "const": "packages/launch/npm-shrinkwrap.json"
            },
            "sha256": {
              "type": "string",
              "pattern": "^sha256:[0-9a-f]{64}$"
            }
          }
        },
        {
          "type": "object",
          "additionalProperties": false,
          "required": [
            "path",
            "sha256"
          ],
          "properties": {
            "path": {
              "const": "packages/launch/src/constants.mjs"
            },
            "sha256": {
              "type": "string",
              "pattern": "^sha256:[0-9a-f]{64}$"
            }
          }
        },
        {
          "type": "object",
          "additionalProperties": false,
          "required": [
            "path",
            "sha256"
          ],
          "properties": {
            "path": {
              "const": "packages/launch/src/cli.mjs"
            },
            "sha256": {
              "type": "string",
              "pattern": "^sha256:[0-9a-f]{64}$"
            }
          }
        },
        {
          "type": "object",
          "additionalProperties": false,
          "required": [
            "path",
            "sha256"
          ],
          "properties": {
            "path": {
              "const": "packages/launch/src/index.mjs"
            },
            "sha256": {
              "type": "string",
              "pattern": "^sha256:[0-9a-f]{64}$"
            }
          }
        },
        {
          "type": "object",
          "additionalProperties": false,
          "required": [
            "path",
            "sha256"
          ],
          "properties": {
            "path": {
              "const": "packages/launch/src/api-client.mjs"
            },
            "sha256": {
              "type": "string",
              "pattern": "^sha256:[0-9a-f]{64}$"
            }
          }
        },
        {
          "type": "object",
          "additionalProperties": false,
          "required": [
            "path",
            "sha256"
          ],
          "properties": {
            "path": {
              "const": "packages/launch/src/api-response.mjs"
            },
            "sha256": {
              "type": "string",
              "pattern": "^sha256:[0-9a-f]{64}$"
            }
          }
        },
        {
          "type": "object",
          "additionalProperties": false,
          "required": [
            "path",
            "sha256"
          ],
          "properties": {
            "path": {
              "const": "packages/launch/src/canonical-json.mjs"
            },
            "sha256": {
              "type": "string",
              "pattern": "^sha256:[0-9a-f]{64}$"
            }
          }
        },
        {
          "type": "object",
          "additionalProperties": false,
          "required": [
            "path",
            "sha256"
          ],
          "properties": {
            "path": {
              "const": "packages/launch/src/io.mjs"
            },
            "sha256": {
              "type": "string",
              "pattern": "^sha256:[0-9a-f]{64}$"
            }
          }
        },
        {
          "type": "object",
          "additionalProperties": false,
          "required": [
            "path",
            "sha256"
          ],
          "properties": {
            "path": {
              "const": "packages/launch/src/launch-coverage-v1.mjs"
            },
            "sha256": {
              "type": "string",
              "pattern": "^sha256:[0-9a-f]{64}$"
            }
          }
        },
        {
          "type": "object",
          "additionalProperties": false,
          "required": [
            "path",
            "sha256"
          ],
          "properties": {
            "path": {
              "const": "packages/launch/schemas/robinhood-launch-coverage-v1.json"
            },
            "sha256": {
              "type": "string",
              "pattern": "^sha256:[0-9a-f]{64}$"
            }
          }
        },
        {
          "type": "object",
          "additionalProperties": false,
          "required": [
            "path",
            "sha256"
          ],
          "properties": {
            "path": {
              "const": "packages/launch/bin/programmable-launch.mjs"
            },
            "sha256": {
              "type": "string",
              "pattern": "^sha256:[0-9a-f]{64}$"
            }
          }
        },
        {
          "type": "object",
          "additionalProperties": false,
          "required": [
            "path",
            "sha256"
          ],
          "properties": {
            "path": {
              "const": "packages/launch/README.md"
            },
            "sha256": {
              "type": "string",
              "pattern": "^sha256:[0-9a-f]{64}$"
            }
          }
        },
        {
          "type": "object",
          "additionalProperties": false,
          "required": [
            "path",
            "sha256"
          ],
          "properties": {
            "path": {
              "const": "packages/launch/src/pack.mjs"
            },
            "sha256": {
              "type": "string",
              "pattern": "^sha256:[0-9a-f]{64}$"
            }
          }
        },
        {
          "type": "object",
          "additionalProperties": false,
          "required": [
            "path",
            "sha256"
          ],
          "properties": {
            "path": {
              "const": "packages/launch/src/validate.mjs"
            },
            "sha256": {
              "type": "string",
              "pattern": "^sha256:[0-9a-f]{64}$"
            }
          }
        },
        {
          "type": "object",
          "additionalProperties": false,
          "required": [
            "path",
            "sha256"
          ],
          "properties": {
            "path": {
              "const": "packages/launch/src/profile-direct-native-v1.mjs"
            },
            "sha256": {
              "type": "string",
              "pattern": "^sha256:[0-9a-f]{64}$"
            }
          }
        },
        {
          "type": "object",
          "additionalProperties": false,
          "required": [
            "path",
            "sha256"
          ],
          "properties": {
            "path": {
              "const": "packages/launch/src/canonical-settlement-fee-vault-v1.mjs"
            },
            "sha256": {
              "type": "string",
              "pattern": "^sha256:[0-9a-f]{64}$"
            }
          }
        },
        {
          "type": "object",
          "additionalProperties": false,
          "required": [
            "path",
            "sha256"
          ],
          "properties": {
            "path": {
              "const": "packages/launch/src/canonical-settlement-fee-vault-v2.mjs"
            },
            "sha256": {
              "type": "string",
              "pattern": "^sha256:[0-9a-f]{64}$"
            }
          }
        },
        {
          "type": "object",
          "additionalProperties": false,
          "required": [
            "path",
            "sha256"
          ],
          "properties": {
            "path": {
              "const": "packages/launch/src/settlement-fee-vault-validation.mjs"
            },
            "sha256": {
              "type": "string",
              "pattern": "^sha256:[0-9a-f]{64}$"
            }
          }
        },
        {
          "type": "object",
          "additionalProperties": false,
          "required": [
            "path",
            "sha256"
          ],
          "properties": {
            "path": {
              "const": "packages/launch/schemas/programmable-launch-pack-config-v3.5.json"
            },
            "sha256": {
              "type": "string",
              "pattern": "^sha256:[0-9a-f]{64}$"
            }
          }
        },
        {
          "type": "object",
          "additionalProperties": false,
          "required": [
            "path",
            "sha256"
          ],
          "properties": {
            "path": {
              "const": "packages/launch/contracts/settlement-fee-vault-v2/EthereumSettlementFeeVaultV2.artifact.json"
            },
            "sha256": {
              "type": "string",
              "pattern": "^sha256:[0-9a-f]{64}$"
            }
          }
        },
        {
          "type": "object",
          "additionalProperties": false,
          "required": [
            "path",
            "sha256"
          ],
          "properties": {
            "path": {
              "const": "packages/launch/contracts/settlement-fee-vault-v2/EthereumSettlementFeeVaultV2.build.json"
            },
            "sha256": {
              "type": "string",
              "pattern": "^sha256:[0-9a-f]{64}$"
            }
          }
        },
        {
          "type": "object",
          "additionalProperties": false,
          "required": [
            "path",
            "sha256"
          ],
          "properties": {
            "path": {
              "const": "packages/launch/contracts/settlement-fee-vault-v2/EthereumSettlementFeeVaultV2.standard-json.json"
            },
            "sha256": {
              "type": "string",
              "pattern": "^sha256:[0-9a-f]{64}$"
            }
          }
        },
        {
          "type": "object",
          "additionalProperties": false,
          "required": [
            "path",
            "sha256"
          ],
          "properties": {
            "path": {
              "const": "packages/launch/contracts/settlement-fee-vault-v2/release-binding.v2.json"
            },
            "sha256": {
              "type": "string",
              "pattern": "^sha256:[0-9a-f]{64}$"
            }
          }
        },
        {
          "type": "object",
          "additionalProperties": false,
          "required": [
            "path",
            "sha256"
          ],
          "properties": {
            "path": {
              "const": "packages/launch/src/pack-current-profile.mjs"
            },
            "sha256": {
              "type": "string",
              "pattern": "^sha256:[0-9a-f]{64}$"
            }
          }
        },
        {
          "type": "object",
          "additionalProperties": false,
          "required": [
            "path",
            "sha256"
          ],
          "properties": {
            "path": {
              "const": "packages/launch/src/profile-v36.mjs"
            },
            "sha256": {
              "type": "string",
              "pattern": "^sha256:[0-9a-f]{64}$"
            }
          }
        },
        {
          "type": "object",
          "additionalProperties": false,
          "required": [
            "path",
            "sha256"
          ],
          "properties": {
            "path": {
              "const": "packages/launch/schemas/programmable-launch-pack-config-v3.6.json"
            },
            "sha256": {
              "type": "string",
              "pattern": "^sha256:[0-9a-f]{64}$"
            }
          }
        }
      ],
      "items": false
    },
    "machineContracts": {
      "type": "array",
      "minItems": 2,
      "maxItems": 2,
      "prefixItems": [
        {
          "type": "object",
          "additionalProperties": false,
          "required": [
            "name",
            "path",
            "url",
            "sha256"
          ],
          "properties": {
            "name": {
              "const": "openapi"
            },
            "path": {
              "const": "public/openapi/launch-coverage-v1.json"
            },
            "url": {
              "const": "https://programmable.market/openapi/launch-coverage-v1.json"
            },
            "sha256": {
              "type": "string",
              "pattern": "^sha256:[0-9a-f]{64}$"
            }
          }
        },
        {
          "type": "object",
          "additionalProperties": false,
          "required": [
            "name",
            "path",
            "url",
            "sha256"
          ],
          "properties": {
            "name": {
              "const": "response"
            },
            "path": {
              "const": "public/schemas/custom-launch/coverage/v1.json"
            },
            "url": {
              "const": "https://programmable.market/schemas/custom-launch/coverage/v1.json"
            },
            "sha256": {
              "type": "string",
              "pattern": "^sha256:[0-9a-f]{64}$"
            }
          }
        }
      ],
      "items": false
    },
    "ethereumClient": {
      "type": "object",
      "additionalProperties": false,
      "required": [
        "chainId",
        "requestSchemaVersion",
        "offlineBuilderDefaultProfileVersion",
        "freshCliDefaultSelection",
        "candidateProfileVersion",
        "packConfigSchemaPath",
        "candidateActivation",
        "profile36Version",
        "profile36PackConfigSchemaPath",
        "profile36TradeFeePolicyHash",
        "activatesWriteProfile",
        "requiresCliForDirectHttp"
      ],
      "properties": {
        "chainId": {
          "const": "1"
        },
        "requestSchemaVersion": {
          "const": "programmable.custom-launch-create-request.v3"
        },
        "offlineBuilderDefaultProfileVersion": {
          "const": "3.3.0"
        },
        "freshCliDefaultSelection": {
          "const": "current-server-capabilities"
        },
        "candidateProfileVersion": {
          "const": "3.5.0"
        },
        "packConfigSchemaPath": {
          "const": "packages/launch/schemas/programmable-launch-pack-config-v3.5.json"
        },
        "candidateActivation": {
          "const": "requires-server-capabilities"
        },
        "profile36Version": {
          "const": "3.6.0"
        },
        "profile36PackConfigSchemaPath": {
          "const": "packages/launch/schemas/programmable-launch-pack-config-v3.6.json"
        },
        "profile36TradeFeePolicyHash": {
          "const": "sha256:5956cdeee628ba84dfa5214efd532011e59c202e4e1c1830b1eca279d58d79d3"
        },
        "activatesWriteProfile": {
          "const": false
        },
        "requiresCliForDirectHttp": {
          "const": false
        }
      }
    }
  }
}
